<?xml version="1.0" encoding="UTF-8"?>
<file xmlns:xsi="http://www.w3.org/2001/XMLSchema-instance" xsi:noNamespaceSchemaLocation="http://www.pecina.cz/xsd/bin-1.0.xsd" version="1.0">
  <stream>
    <crc name="c" model="CRC-16/USB" xor-in="0"/>
    <hex>
      FFFF
    </hex>
  </stream>
  <stream width-in="16" width-aggregate-out="16" endianness-out="little">
    <put name="c"/>
  </stream>
  <stream repeat="12">
    0xee
  </stream>
  <stream>
    <crc name="c" model="CRC-16/USB"/>
    <hex>
      00010203
      EF7A
    </hex>
  </stream>
  <stream width-in="16" width-aggregate-out="16" endianness-out="little">
    <put name="c"/>
  </stream>
  <stream repeat="8">
    0xee
  </stream>
  <stream>
    <crc name="c" model="CRC-16/USB"/>
    <hex>
      2345 6789
      0E1C
    </hex>
  </stream>
  <stream width-in="16" width-aggregate-out="16" endianness-out="little">
    <put name="c"/>
  </stream>
  <stream repeat="8">
    0xee
  </stream>
</file>
