<?xml version="1.0" encoding="UTF-8"?>
<file xmlns:xsi="http://www.w3.org/2001/XMLSchema-instance" xsi:noNamespaceSchemaLocation="http://www.pecina.cz/xsd/bin-1.0.xsd" version="1.0">
  <stream>
    <crc name="c" model="KERMIT"/>
    <hex>
      54A114
    </hex>
  </stream>
  <stream width-in="16">
    <put name="c"/>
  </stream>
  <stream repeat="11">
    0xee
  </stream>
  <stream>
    <crc name="c" model="KERMIT"/>
    <hex>
      4361744D6F7573653938373635343332318DC2
    </hex>
  </stream>
  <stream width-in="16">
    <put name="c"/>
  </stream>
  <stream repeat="11">
    0xee
  </stream>
</file>
