<?xml version="1.0" encoding="UTF-8"?>
<file xmlns:xsi="http://www.w3.org/2001/XMLSchema-instance" xsi:noNamespaceSchemaLocation="http://www.pecina.cz/xsd/bin-1.0.xsd" version="1.0">
  <stream>
    <hex>
      <set name="c0" value="0x55"/>
      <put name=" c0"/>
    </hex>
  </stream>
  <stream width-aggregate-in="32" endianness-in="big">
    <hex>
      11 22 33 44
    </hex>
  </stream>
  <stream width-aggregate-in="32" endianness-in="little">
    <hex>
      11 22 33 44
    </hex>
  </stream>
  <stream width-aggregate-in="32">
    <hex>
      11 22 33 44
    </hex>
  </stream>
</file>
