<?xml version="1.0" encoding="UTF-8"?>
<file xmlns:xsi="http://www.w3.org/2001/XMLSchema-instance" xsi:noNamespaceSchemaLocation="http://www.pecina.cz/xsd/bin-1.0.xsd" version="1.0">
  <stream>
    <crc name="c" model="CRC-16/EN-13757"/>
    <reset name="i"/>
    <hex>
      ffff
    </hex>
  </stream>
  <stream width-in="16">
    <put name="c"/>
  </stream>
  <stream repeat="12">
    0xee
  </stream>
  <stream>
    <crc name="c" model="CRC-16/EN-13757"/>
    <reset name="i"/>
    <hex>
      780B13436587
      1E6D
    </hex>
  </stream>
  <stream width-in="16">
    <put name="c"/>
  </stream>
  <stream repeat="6">
    0xee
  </stream>
  <stream>
    <crc name="c" model="CRC-16/EN-13757"/>
    <reset name="i"/>
    <hex>
      07400001AAAA0000
      363E
    </hex>
  </stream>
  <stream width-in="16">
    <put name="c"/>
  </stream>
  <stream repeat="4">
    0xee
  </stream>
</file>
